{
  "userID": "000000",
  "timestamp": {
    "videoStart": "2026-02-01 23:52:36",
    "shotTime": "2026-02-01 23:52:39",
    "videoEnd": "2026-02-01 23:52:48"
  },
  "mode": "Side",
  "ballTrajectory": [
    [
      1081,
      193
    ],
    [
      1052,
      159
    ],
    [
      1025,
      130
    ],
    [
      994,
      106
    ],
    [
      964,
      80
    ],
    [
      939,
      58
    ],
    [
      915,
      39
    ],
    [
      890,
      19
    ],
    [
      865,
      -1
    ],
    [
      840,
      -22
    ],
    [
      815,
      -42
    ],
    [
      773,
      0
    ],
    [
      743,
      -4
    ],
    [
      714,
      -8
    ],
    [
      685,
      -13
    ],
    [
      665,
      0
    ],
    [
      639,
      1
    ],
    [
      612,
      2
    ],
    [
      594,
      15
    ],
    [
      570,
      20
    ],
    [
      523,
      52
    ],
    [
      500,
      61
    ],
    [
      475,
      80
    ],
    [
      454,
      103
    ],
    [
      429,
      121
    ],
    [
      404,
      134
    ],
    [
      386,
      131
    ],
    [
      380,
      126
    ],
    [
      380,
      123
    ],
    [
      393,
      134
    ],
    [
      402,
      139
    ],
    [
      420,
      145
    ],
    [
      431,
      153
    ],
    [
      439,
      161
    ],
    [
      453,
      162
    ],
    [
      432,
      146
    ],
    [
      422,
      138
    ],
    [
      429,
      185
    ],
    [
      430,
      209
    ],
    [
      426,
      217
    ],
    [
      418,
      220
    ],
    [
      408,
      220
    ],
    [
      398,
      222
    ],
    [
      389,
      231
    ],
    [
      380,
      237
    ],
    [
      373,
      263
    ],
    [
      363,
      280
    ],
    [
      356,
      300
    ],
    [
      348,
      326
    ],
    [
      339,
      355
    ],
    [
      331,
      388
    ],
    [
      323,
      422
    ],
    [
      315,
      459
    ],
    [
      305,
      497
    ],
    [
      295,
      541
    ],
    [
      285,
      587
    ],
    [
      276,
      637
    ],
    [
      265,
      690
    ],
    [
      254,
      749
    ]
  ],
  "jointAngles": {
    "elbow": 84.05583913101816,
    "wrist": 148.3459662700614
  },
  "ballReleaseMoment": {
    "height": 472,
    "ballLocation": {
      "horizontal": null,
      "vertical": 1.3919491525423728
    }
  }
}